{
    "$schema": "http://json-schema.org/draft-07/schema",

    "type": "object",
    "required": ["slug", "name"],
    "additionalProperties": false,
    "properties": {
        "slug": { "$ref": "slug.schema.json" },
        "name": { "type": "string" },
        "duration": { "$ref": "daterange.schema.json" },
        "links": { "type": "array", "items": { "$ref": "extern-link.schema.json" } },
        "participants": { "type": "array", "items": { "$ref": "official-lineup.schema.json#/$defs/shorthand" } },
        "brackets": { "type": "array", "items": { "$ref": "official-bracket.schema.json" } },
        "matches": { "type": "array", "items": { "$ref": "official-match.schema.json" } },
        "note": { "type": "string" },
        "tags": { "type": "array", "items": { "$ref": "#/$defs/tag" } }
    },

    "$defs": {
        "tag": {
            "type": "string",
            "enum": ["transparent", "lan"]
        }
    }
}
